{"$id":"https://orbital-dynamics.local/schemas/validation_tolerance_policy.v1.schema.json","$schema":"https://json-schema.org/draft/2020-12/schema","additionalProperties":true,"properties":{"artifact_regressions":{"type":"object"},"comparison_model":{"type":"object"},"event_timing":{"type":"object"},"schema_contract":{"const":"validation_tolerance_policy.v1","description":"Stable executable contract identifier","type":"string"},"validation_levels":{"type":"object"}},"required":["schema_contract","comparison_model","event_timing","artifact_regressions","validation_levels"],"title":"OrbitalDynamics validation_tolerance_policy.v1","type":"object","x-orbital-dynamics":{"artifact_family":"validation_tolerance_policy","compatibility_policy":{"breaking_change_action":"mint a new schema_contract name or increment the artifact schema_version before publishing","breaking_changes":["remove_required_fields","change_required_field_type","change_schema_contract_identifier","change_schema_version_const","change_required_field_semantics"],"compatible_changes":["add_optional_fields","add_optional_nested_contracts","tighten_executable_semantic_validation_without_changing_exported_required_fields"],"policy_version":1,"validation_mode":"top_level_compatibility_export"},"compatibility_policy_version":1,"executable_contract":true,"identity_policy":{"breaking_changes":["change_existing_public_identifier_for_the_same_semantic_entity","emit_blank_identifier","emit_identifier_with_whitespace"],"compatible_changes":["add_optional_identifier_fields","add_more_specific_semantic_source_metadata_without_changing_existing_ids"],"description":"Public artifact identifiers are non-empty machine identifiers without whitespace.","generated_id_scopes":[{"identity_fields":["scenario_id","type","source_window_id","target_id","ground_station_id"],"ordering":["result_event_type","scenario_id","source_window_id","starts_at_s"],"scope":"candidate_refresh.v1.candidate_activities"},{"generated_id_field":"id","identity_fields":["type","scenario_id","target_id","ground_station_id","starts_at_s","ends_at_s"],"ordering":["type","scenario_id","target_id","ground_station_id","starts_at_s","id"],"scope":"candidate_refresh.v1.refreshed_windows.generated_window_id","semantic_invariants":["source_record_order_must_not_change_generated_window_id","canonical_source_event_sort_key_must_drive_window_index","same_semantic_source_window_must_keep_generated_window_id"]},{"identity_fields":["spacecraft_id","scenario_id","epoch.seconds_since_j2000"],"ordering":["spacecraft_id","scenario_id","epoch.seconds_since_j2000"],"scope":"accepted_planning_state.v1.spacecraft_states"},{"generated_id_field":"id","identity_fields":["resource_scope","ground_station_id","spacecraft_id","starts_at_s","ends_at_s","contact_ids"],"ordering":["resource_scope","ground_station_id","spacecraft_id","starts_at_s","id"],"scope":"contact_contention_report.v1.conflict_groups.generated_group_id","semantic_invariants":["source_record_order_must_not_change_generated_group_id","canonical_contact_sort_key_must_drive_conflict_group_index","same_semantic_contention_group_must_keep_generated_group_id"]},{"generated_id_field":"group_id","identity_fields":["group_id","resource_scope","ground_station_id","spacecraft_id","starts_at_s","selected_contact_id","deferred_contact_ids"],"ordering":["resource_scope","ground_station_id","spacecraft_id","starts_at_s","group_id"],"scope":"contact_contention_resolution_report.v1.recommendations.generated_group_id","semantic_invariants":["contention_group_id_must_flow_to_recommendation_group_id","source_record_order_must_not_change_recommendation_group_id","resolution_ordering_must_not_change_group_identity"]},{"explicit_id_fields":["route_id","id","data_path_id"],"identity_fields":["source_spacecraft_id","relay_chain_spacecraft_ids","ground_station_id","ground_downlink_contact_id","latency_s","latency_limit_s","product_ids","collection_ids"],"ordering":["source_spacecraft_id","ground_downlink_contact_id","semantic_route_fingerprint"],"scope":"relay_data_path_summary.v1.rows.generated_route_id","semantic_invariants":["source_record_order_must_not_change_generated_route_id","semantic_route_evidence_changes_must_change_generated_route_id","explicit_route_id_takes_precedence_over_generated_route_id"]}],"policy_version":1,"semantic_invariants":["source_record_order_must_not_change_generated_identity","semantic_source_identity_must_remain_stable_across_manifest_export","scenario_and_activity_identity_must_not_depend_on_wall_clock_time"],"stable_id_pattern":"^[A-Za-z0-9][A-Za-z0-9._:@-]*$"},"identity_policy_version":1,"nested_contract_definition_scope":"direct_declared_contracts","nested_contracts":[],"schema_contract":"validation_tolerance_policy.v1","schema_version":1,"validation_mode":"top_level_compatibility_export"}}
