{"artifact_regressions":{"limit":"not an external physics or operations truth model","scope":"schema and public-surface stability checks for checked-in artifacts"},"comparison_model":{"non_numeric_values":"exact equality is required","numeric_scalars":"absolute error must be less than or equal to the fixture field tolerance","numeric_vectors":"maximum component-wise absolute error must be less than or equal to the fixture field tolerance"},"event_timing":{"confidence":"bounded_by_sample_cadence unless the event occurs on a single exact sample","current_policy":"sampled_state_linear_boundary","event_time_tolerance_s":"maximum adjacent trajectory sample spacing","limit":"linear interpolation improves reported boundary placement but does not justify a tighter validation claim"},"schema_contract":"validation_tolerance_policy.v1","validation_levels":{"analysis":"suitable for early trade studies inside stated assumptions and tolerances","artifact_contract":"artifact structure and stable public fields are regression-tested","assumption_declared":"assumption or environment capability is documented but not validated against a reference","educational":"suitable for examples and internal demonstrations inside the stated covered regime","validated":"reserved for future external reference-tool or operational validation evidence"}}
